{
  "_comment": "support-ticket workflow — statewright MachineDefinition encoding the shipped jira-ticket FSM. Authored 2026-09-11 for OpenSpec change statewright-workflow-layer, task 3.1. Sources of truth: docs/statewright/cheatsheet.md (shape) and docs/statewright/jira-ticket-fsm.md (state + transition extraction). Human gates (task 3.2) and JSON Schema (task 3.3) are layered on separately.",
  "id": "support-ticket",
  "initial": "discover",
  "context": {},
  "meta": {
    "task_type": "support-ticket",
    "estimated_steps": 21,
    "danger_level": "moderate",
    "extra": {
      "workflow_version": "0.1.0",
      "provenance": "docs/statewright/jira-ticket-fsm.md"
    }
  },
  "states": {
    "discover": {
      "instructions": "One-time per-ticket setup: create try dir, seed Dust conversation, jiraai-review dump (ticket.md + related.md), extract related MRs, claim herdr tab, stamp bead DAG via beads-decompose. Read-only w.r.t. code; may mutate the try dir and beads DB.",
      "allowed_tools": [
        "Read",
        "Grep",
        "Glob",
        "LS",
        "Bash",
        "Write",
        "jiraai-review",
        "beads-decompose",
        "dust",
        "ghq",
        "try",
        "herdr",
        "herdr-layout",
        "beads"
      ],
      "on": {
        "SETUP_STEP_ADVANCE": "discover",
        "SETUP_COMPLETE_CAPABILITY_EMPTY": "set_capability",
        "SETUP_COMPLETE_CAPABILITY_SET": "explore",
        "RELATED_MR_OPT_IN": {
          "target": "watch_related_mr",
          "requires_approval": true,
          "approval_message": "Opt in to watch a related MR? (parallel observation lane, one bead per URL)"
        }
      }
    },
    "set_capability": {
      "instructions": "Write customfield_11907 (PLAT Platform Capability) via jiraai-edit. Independent of the code-fix lane but blocks close/archive. Auto-skips to explore if jira-pick already set it upstream.",
      "allowed_tools": [
        "Read",
        "Bash",
        "jiraai-edit",
        "jira-pick",
        "beads"
      ],
      "on": {
        "CAPABILITY_WRITTEN": "explore"
      }
    },
    "explore": {
      "instructions": "Read-only fact gathering. Reproduce the bug, write proof.md with a verified repro and a root-cause hypothesis. NO mutations: no apply / patch / mr create / bd close.",
      "allowed_tools": [
        "Read",
        "Grep",
        "Glob",
        "LS",
        "Bash",
        "Write",
        "jira-explore",
        "jiraai-review",
        "jiraai-list",
        "dust",
        "ci-watch",
        "explicit-cluster-context",
        "ezsre",
        "aws",
        "kubectl",
        "pup",
        "glab",
        "herdr-find",
        "beads"
      ],
      "on": {
        "EVIDENCE_ADDED": "explore",
        "PROOF_GREEN": "propose_fix"
      }
    },
    "propose_fix": {
      "instructions": "Design the smallest correct fix. Enumerate at least 2 alternatives. Run Dust rounds (prior art + sanity). Write fix.md. NO code writes yet: no editor, no git commit, no MR ops.",
      "allowed_tools": [
        "Read",
        "Grep",
        "Glob",
        "LS",
        "Bash",
        "Write",
        "jira-fix",
        "dust",
        "hunk",
        "openspec-propose",
        "beads"
      ],
      "on": {
        "DUST_ROUND": "propose_fix",
        "OPERATOR_APPROVES_FIX_MD": {
          "target": "fix",
          "requires_approval": true,
          "approval_message": "Approve fix.md design and unlock implementation?"
        }
      }
    },
    "fix": {
      "instructions": "Approval-gate alias. Pause point between propose_fix and implement. No tools invoked; the operator OK IS the implementation-start signal.",
      "allowed_tools": [],
      "on": {
        "IMPLICIT": "implement"
      }
    },
    "implement": {
      "instructions": "Code the fix in the worktree. Commit with commit-rationale. Open the MR via glab-mr-open (the ONLY sanctioned MR-creation path). Run the mandatory glab-mr-ready probe. Iterate on red rows.",
      "allowed_tools": [
        "Read",
        "Grep",
        "Glob",
        "LS",
        "Edit",
        "Write",
        "Bash",
        "jira-fix",
        "commit-rationale",
        "hunk",
        "glab-mr-open",
        "glab-mr-title",
        "glab-mr-assign",
        "glab-mr-ready",
        "jiraai-link",
        "jiraai-comment",
        "jiraai-edit",
        "mm-skills-gitlab-mr",
        "ci-watch",
        "beads"
      ],
      "on": {
        "READINESS_RED": "implement",
        "MR_OPENED": {
          "target": "ci_green",
          "requires_approval": true,
          "approval_message": "Human review of the implementation complete; hand off to CI?"
        }
      }
    },
    "ci_green": {
      "instructions": "Wait for the head pipeline to reach 'success'. Poll via glab-mr-ready. Arm async-wait on watch:pipeline=<id>. On failure, hand back to fix.",
      "allowed_tools": [
        "Read",
        "Bash",
        "glab",
        "glab-mr-ready",
        "ci-watch",
        "async-wait",
        "beads"
      ],
      "allowed_commands": [
        "glab api projects/*/pipelines/*",
        "glab api projects/*/merge_requests/*",
        "glab ci *",
        "glab mr view *"
      ],
      "on": {
        "PIPELINE_RUNNING": "ci_green",
        "PIPELINE_SUCCESS": "review",
        "PIPELINE_FAILED": {
          "target": "fix",
          "requires_approval": true,
          "approval_message": "CI pipeline failed; re-enter fix loop? (retry after pipeline red)"
        }
      }
    },
    "review": {
      "instructions": "Assign reviewers via glab-mr-assign (verified usernames + '+'-add). Post @mention on the Jira ticket. Loop on unresolved discussion threads until approvals are green.",
      "allowed_tools": [
        "Read",
        "Grep",
        "Bash",
        "jira-review",
        "glab",
        "glab-mr-assign",
        "glab-mr-ready",
        "jiraai-comment",
        "jiraai-review",
        "mm-skills-gitlab-mr",
        "beads"
      ],
      "on": {
        "UNRESOLVED_THREAD": "review",
        "APPROVALS_GREEN": {
          "target": "merge",
          "requires_approval": true,
          "approval_message": "Approvals green; proceed to merge?"
        }
      }
    },
    "merge": {
      "instructions": "Re-probe with glab-mr-ready. Merge with squash + remove-source-branch. Verify state == merged and merge_commit_sha != null. On merge_error, hand back to review.",
      "allowed_tools": [
        "Read",
        "Bash",
        "jira-merge",
        "glab",
        "glab-mr-ready",
        "jiraai-comment",
        "ci-watch",
        "beads"
      ],
      "allowed_commands": [
        "glab mr merge *",
        "glab mr view *",
        "glab api *"
      ],
      "on": {
        "READINESS_STALE_CHECK": "merge",
        "MR_MERGED": {
          "target": "tag",
          "requires_approval": true,
          "approval_message": "MR merged; cut a tag (skip if repo is not tag-managed)?"
        },
        "MERGE_ERROR": "review"
      }
    },
    "tag": {
      "instructions": "Detect tag-management (.releaserc*, .goreleaser.*, recent semver, release CI job). Cut the tag OR skip-close if the repo is not tag-managed.",
      "allowed_tools": [
        "Read",
        "Grep",
        "Glob",
        "LS",
        "Bash",
        "jira-merge",
        "commit-rationale",
        "beads"
      ],
      "allowed_commands": [
        "git tag *",
        "git push origin *",
        "glab release create *",
        "git log *"
      ],
      "on": {
        "TAG_CUT_OR_SKIPPED": "deploy_dev"
      }
    },
    "deploy_dev": {
      "instructions": "Fire the dev deploy job (Spinak manual play / Argo sync / Terraform noop). Write deploy.md with rollback command. Arm async-wait on watch:pipeline=<id> or watch:rollout=<ns/deploy>.",
      "allowed_tools": [
        "Read",
        "Bash",
        "Write",
        "jira-deploy",
        "ci-watch",
        "k8s-watch",
        "async-wait",
        "explicit-cluster-context",
        "glab",
        "kubectl",
        "beads"
      ],
      "allowed_commands": [
        "helm *",
        "kubectl rollout *",
        "kubectl get *",
        "kubectl describe *",
        "argocd app sync *",
        "argocd app wait *",
        "glab api projects/*/pipelines/*",
        "glab api projects/*/jobs/*/play",
        "glab ci *"
      ],
      "on": {
        "DEPLOY_JOB_FIRED": "verify_dev"
      }
    },
    "verify_dev": {
      "instructions": "Run the jira-monitor tactic menu (pup / kubectl / aws / dig / curl). 1200s baseline wait is skippable in dev per operator preference. Rollup GREEN / YELLOW / RED.",
      "allowed_tools": [
        "Read",
        "Bash",
        "Write",
        "jira-monitor",
        "pup",
        "kubectl",
        "helm",
        "aws",
        "async-wait",
        "explicit-cluster-context",
        "ci-watch",
        "k8s-watch",
        "s3-watch",
        "beads"
      ],
      "allowed_commands": [
        "pup *",
        "kubectl get *",
        "kubectl describe *",
        "kubectl logs *",
        "kubectl top *",
        "kubectl rollout status *",
        "helm status *",
        "helm history *",
        "aws sts get-caller-identity",
        "aws lambda get-function *",
        "aws logs filter-log-events *",
        "dig *",
        "curl *"
      ],
      "on": {
        "BASELINE_WAIT": "verify_dev",
        "VERIFY_GREEN": "deploy_staging",
        "VERIFY_RED": {
          "target": "fix",
          "requires_approval": true,
          "approval_message": "verify_dev RED; re-enter fix loop? (retry after pipeline red)"
        }
      }
    },
    "deploy_staging": {
      "instructions": "Same shape as deploy_dev, targeting staging. Arm async-wait on the staging pipeline / rollout.",
      "allowed_tools": [
        "Read",
        "Bash",
        "Write",
        "jira-deploy",
        "ci-watch",
        "k8s-watch",